{
  "$schema": "./components.schema.json",
  "schemaVersion": "1.0.0",
  "product": {
    "id": "plwc_windows",
    "name": "PLwC for Windows",
    "platform": "win32",
    "appDataRoot": "%APPDATA%\\PLwC",
    "releaseVersion": "1.0.0",
    "gatewayVersion": "1.0.0",
    "chatBridgeVersion": "1.0.0"
  },
  "installerTokens": {
    "{pythonExe}": "Absolute Python 3.11 or newer executable resolved by the installer.",
    "{extensionId}": "Stable PLwC Chat Bridge extension ID nlogfcafjdfdoknpkbehjgihpafpipdb.",
    "{browser}": "Selected native-messaging browser target: Chrome, Edge, Brave, Both, or All."
  },
  "managedDirectories": [
    {
      "id": "app",
      "path": "%APPDATA%\\PLwC\\app",
      "purpose": "Versioned application payloads and verified package copies.",
      "mutability": "installer_managed",
      "preserveOnUpgrade": true,
      "preserveOnUninstall": false
    },
    {
      "id": "workspace",
      "path": "%APPDATA%\\PLwC\\workspace",
      "purpose": "Default governed PLwC workspace.",
      "mutability": "user_managed",
      "preserveOnUpgrade": true,
      "preserveOnUninstall": true
    },
    {
      "id": "profiles",
      "path": "%APPDATA%\\PLwC\\profiles",
      "purpose": "Profile-owned governance, memory, persona, temperament, journal, and reflection state.",
      "mutability": "user_managed",
      "preserveOnUpgrade": true,
      "preserveOnUninstall": true
    },
    {
      "id": "config",
      "path": "%APPDATA%\\PLwC\\config",
      "purpose": "Runtime-wide configuration and installer-generated client descriptors.",
      "mutability": "user_managed",
      "preserveOnUpgrade": true,
      "preserveOnUninstall": true
    },
    {
      "id": "state",
      "path": "%APPDATA%\\PLwC\\state",
      "purpose": "Runtime-wide mutable state.",
      "mutability": "runtime_managed",
      "preserveOnUpgrade": true,
      "preserveOnUninstall": true
    },
    {
      "id": "logs",
      "path": "%APPDATA%\\PLwC\\logs",
      "purpose": "Runtime and installer logs.",
      "mutability": "runtime_managed",
      "preserveOnUpgrade": true,
      "preserveOnUninstall": true
    },
    {
      "id": "profile_backups",
      "path": "%APPDATA%\\PLwC\\profile_backups",
      "purpose": "Recoverable profile backups made before import, migration, or governed administration.",
      "mutability": "installer_managed",
      "preserveOnUpgrade": true,
      "preserveOnUninstall": true
    }
  ],
  "components": [
    {
      "id": "gateway_runtime",
      "displayName": "PLwC Gateway runtime",
      "kind": "gateway_runtime",
      "version": "1.0.0",
      "availability": "actual",
      "description": "Shared eight-tool plwc-gateway stdio runtime used by all selectable client integrations.",
      "selection": {
        "defaultSelected": true,
        "required": true,
        "visibility": "user"
      },
      "dependsOn": [],
      "installStrategy": {
        "mode": "copy_tree"
      },
      "payloads": [
        {
          "id": "gateway_runtime_tree",
          "role": "Executable Python gateway runtime extracted from the verified MCPB payload.",
          "source": {
            "path": "build\\mcpb\\plwc-gateway-1.0.0",
            "state": "actual",
            "repositoryTracked": false,
            "type": "directory"
          },
          "stage": {
            "path": "installer\\windows\\stage\\gateway",
            "state": "prepared",
            "repositoryTracked": false,
            "type": "directory"
          },
          "destination": {
            "path": "%APPDATA%\\PLwC\\app\\gateway",
            "type": "directory",
            "overwritePolicy": "versioned_replace",
            "mutable": false
          },
          "required": true
        },
        {
          "id": "default_profile_template",
          "role": "Initial default profile template; existing profile data is never overwritten.",
          "source": {
            "path": "build\\mcpb\\plwc-gateway-1.0.0\\profiles\\template",
            "state": "actual",
            "repositoryTracked": false,
            "type": "directory"
          },
          "stage": {
            "path": "installer\\windows\\stage\\gateway\\profiles\\template",
            "state": "prepared",
            "repositoryTracked": false,
            "type": "directory"
          },
          "destination": {
            "path": "%APPDATA%\\PLwC\\profiles\\default",
            "type": "directory",
            "overwritePolicy": "create_if_missing",
            "mutable": true
          },
          "required": true
        },
        {
          "id": "security_config_example",
          "role": "Conservative security configuration example, not an implied active user configuration.",
          "source": {
            "path": "build\\mcpb\\plwc-gateway-1.0.0\\config\\security.yaml.example",
            "state": "actual",
            "repositoryTracked": false,
            "type": "file"
          },
          "stage": {
            "path": "installer\\windows\\stage\\gateway\\config\\security.yaml.example",
            "state": "prepared",
            "repositoryTracked": false,
            "type": "file"
          },
          "destination": {
            "path": "%APPDATA%\\PLwC\\config\\security.yaml.example",
            "type": "file",
            "overwritePolicy": "create_if_missing",
            "mutable": true
          },
          "required": true
        }
      ],
      "prerequisites": [
        {
          "id": "windows",
          "type": "operating_system",
          "name": "Windows",
          "scope": "install",
          "required": true,
          "detection": {
            "type": "installer_resolved",
            "value": "win32"
          }
        },
        {
          "id": "python",
          "type": "runtime",
          "name": "Python",
          "scope": "runtime",
          "required": true,
          "version": ">=3.11",
          "detection": {
            "type": "command",
            "value": "python --version"
          }
        },
        {
          "id": "python_dependencies",
          "type": "runtime",
          "name": "Python packages from requirements.txt",
          "scope": "runtime",
          "required": true,
          "version": "mcp; fastembed==0.8.0; qdrant-client==1.18.0",
          "detection": {
            "type": "command",
            "value": "{pythonExe} -c import mcp"
          }
        },
        {
          "id": "docker",
          "type": "optional_service",
          "name": "Docker Desktop",
          "scope": "runtime",
          "required": false,
          "detection": {
            "type": "command",
            "value": "docker version"
          }
        }
      ],
      "installerInputs": [
        {
          "id": "workspace_path",
          "type": "directory",
          "required": true,
          "default": "%APPDATA%\\PLwC\\workspace",
          "description": "Governed workspace root."
        },
        {
          "id": "profiles_path",
          "type": "directory",
          "required": true,
          "default": "%APPDATA%\\PLwC\\profiles",
          "description": "Profile root shared by selected PLwC clients."
        },
        {
          "id": "active_profile_name",
          "type": "string",
          "required": true,
          "default": "default",
          "validationPattern": "^[^\\\\/:*?\"<>|]+$",
          "description": "Initial active profile directory name."
        },
        {
          "id": "security_config",
          "type": "file",
          "required": false,
          "default": "",
          "description": "Optional active security.yaml; empty uses bundled conservative defaults."
        },
        {
          "id": "memory_write_threshold",
          "type": "string",
          "required": true,
          "default": "2",
          "validationPattern": "^[0-9]+$",
          "description": "Minimum confirmed evidence count for memory writes."
        },
        {
          "id": "persona_write_threshold",
          "type": "string",
          "required": true,
          "default": "3",
          "validationPattern": "^[0-9]+$",
          "description": "Minimum confirmed evidence count for persona writes."
        },
        {
          "id": "temperament_write_threshold",
          "type": "string",
          "required": true,
          "default": "2",
          "validationPattern": "^[0-9]+$",
          "description": "Minimum confirmed evidence count for temperament writes."
        },
        {
          "id": "qdrant_enabled",
          "type": "boolean",
          "required": true,
          "default": false,
          "description": "Optional Qdrant retrieval index, disabled by default."
        }
      ],
      "smokeChecks": [
        {
          "id": "gateway_stage_layout",
          "phase": "post_stage",
          "type": "path_contract",
          "required": true,
          "target": "installer\\windows\\stage\\gateway",
          "assertions": [
            {
              "subject": "server.py",
              "operator": "exists",
              "expected": true
            },
            {
              "subject": "src\\plwc_gateway\\mcp\\server.py",
              "operator": "exists",
              "expected": true
            },
            {
              "subject": "manifest.json",
              "operator": "exists",
              "expected": true
            }
          ]
        },
        {
          "id": "gateway_python_compile",
          "phase": "post_install",
          "type": "command",
          "required": true,
          "command": {
            "executable": "{pythonExe}",
            "arguments": [
              "-m",
              "compileall",
              "-q",
              "%APPDATA%\\PLwC\\app\\gateway"
            ]
          },
          "assertions": [
            {
              "subject": "exitCode",
              "operator": "equals",